{
  "$schema": "../../schemas/plugin-manifest.schema.json",
  "name": "tech-radar",
  "displayName": "Tech Radar",
  "version": "2.1.1",
  "description": "Points to the company allowedStack (Bun, Elysia, Drizzle, PostgreSQL, Svelte, BLUE DLS design tokens), fills gaps the stack does not cover (messaging, search, cache, storage, logging, infra), and keeps the legacy ring for pre-2026-10-07 projects.",
  "author": {
    "name": "Acme Corp",
    "email": "plugins@yourcompany.com"
  },
  "homepage": "https://github.com/acme-org-ops/smart-aiagent-plugins",
  "repository": "https://github.com/acme-org-ops/smart-aiagent-plugins",
  "license": "Apache-2.0",
  "category": "developer-tools",
  "keywords": ["tech-radar", "guidelines", "bun", "elysia", "svelte", "blue-dls", "legacy", "constraints", "standards"],
  "tags": ["enforcement", "stack"],
  "platforms": ["cursor", "claude", "codex"],
  "components": {
    "skills": "./skills/",
    "agents": "./agents/",
    "commands": "./commands/",
    "rules": "./rules/"
  }
}
