{
  "$schema": "../../schemas/plugin-manifest.schema.json",
  "name": "code-structure",
  "displayName": "Code Structure",
  "version": "1.3.0",
  "description": "Auto-resolves file placement in Bun workspace monorepos (Svelte + Vite frontend, Elysia + Drizzle backend). Agents consult on every prompt; /check-structure and /fix-structure audit existing repos (legacy stacks advisory).",
  "author": {
    "name": "Acme Corp",
    "email": "plugins@yourcompany.com"
  },
  "homepage": "https://github.com/acme-org-ops/smart-aiagent-plugins",
  "repository": "https://github.com/acme-org-ops/smart-aiagent-plugins",
  "license": "Apache-2.0",
  "category": "developer-tools",
  "keywords": ["monorepo", "architecture", "svelte", "bun", "elysia", "structure", "code-organization"],
  "tags": ["architecture", "enforcement"],
  "platforms": [
    "cursor",
    "claude",
    "codex"
  ],
  "components": {
    "skills": "./skills/",
    "agents": "./agents/",
    "commands": "./commands/",
    "rules": "./rules/"
  }
}
