{
  "$schema": "../../schemas/plugin-manifest.schema.json",
  "name": "gcs-implementations",
  "displayName": "GCS Implementations",
  "version": "1.1.0",
  "description": "Google Cloud Storage for app file/object storage — GCS_PROJECT_ID, GCS_BUCKET, GCS_FOLDER (default folder inside bucket), GKE Workload Identity Federation (WIF) without key files",
  "author": {
    "name": "Acme Corp",
    "email": "plugins@yourcompany.com"
  },
  "homepage": "https://github.com/acme-org-ops/smart-aiagent-plugins",
  "repository": "https://github.com/acme-org-ops/smart-aiagent-plugins",
  "license": "Apache-2.0",
  "category": "developer-tools",
  "keywords": ["gcs", "google-cloud-storage", "wif", "workload-identity", "gke", "buckets", "storage"],
  "tags": ["storage", "gcp", "enforcement"],
  "platforms": ["cursor", "claude", "codex"],
  "components": {
    "skills": "./skills/",
    "agents": "./agents/",
    "commands": "./commands/",
    "rules": "./rules/"
  }
}
