{
  "$schema": "../../schemas/plugin-manifest.schema.json",
  "name": "vibe-knowledge",
  "displayName": "Vibe Knowledge",
  "version": "1.3.0",
  "description": "Publish verified, sanitized learnings from one project chat to a review PR with one command; recall approved topic-indexed cards from a private repository.",
  "author": {
    "name": "Acme Corp",
    "url": "https://github.com/acme-org-ops"
  },
  "homepage": "https://github.com/acme-org-ops/smart-aiagent-plugins",
  "repository": "https://github.com/acme-org-ops/smart-aiagent-plugins",
  "license": "Apache-2.0",
  "category": "developer-tools",
  "keywords": ["knowledge", "memory", "recall", "chat-history", "architecture", "debugging", "review"],
  "platforms": [
    "cursor",
    "claude",
    "codex"
  ],
  "components": {
    "skills": "./skills/",
    "commands": "./commands/"
  }
}
