{
  "$schema": "../../schemas/plugin-manifest.schema.json",
  "name": "sonar-issue-fixer",
  "displayName": "Sonar Issue Fixer",
  "version": "1.2.0",
  "description": "Fix SonarQube issues and check quality gate status against the OPS SonarQube server (platform-aware: acme:<app> keys, the platform-default gate, and Community Build default-branch scope)",
  "author": {
    "name": "Acme Corp",
    "email": "plugins@yourcompany.com"
  },
  "homepage": "https://github.com/acme-org-ops/smart-aiagent-plugins",
  "repository": "https://github.com/acme-org-ops/smart-aiagent-plugins",
  "license": "Apache-2.0",
  "category": "developer-tools",
  "keywords": [
    "sonarqube",
    "sonar",
    "quality-gate",
    "code-quality",
    "security-hotspots"
  ],
  "tags": [
    "quality",
    "sonar"
  ],
  "platforms": [
    "cursor",
    "claude",
    "codex"
  ],
  "components": {
    "skills": "./skills/"
  }
}
